{
  "capability_id": "ligamina.nonebot.math.add",
  "input_schema": {
    "type": "object",
    "properties": {
      "left": { "type": "integer", "minimum": -9007199254740991, "maximum": 9007199254740991 },
      "right": { "type": "integer", "minimum": -9007199254740991, "maximum": 9007199254740991 }
    },
    "required": ["left", "right"],
    "additionalProperties": false
  },
  "output_schema": { "type": "integer", "minimum": -9007199254740991, "maximum": 9007199254740991 },
  "pure": true
}
